{
  "id": "0143",
  "split": "test",
  "label": 0,
  "case_type": "sham",
  "contrast": "same_source",
  "block_size": 160,
  "boundaries": [
    300,
    460
  ],
  "n_verses": 600,
  "provenance": {
    "host_source": "genesis",
    "host_start": 780,
    "host_length_before_insertion": 440,
    "insert_source": "genesis",
    "insert_source_start": 1305
  }
}
