{
  "id": "0438",
  "split": "train",
  "label": 1,
  "case_type": "foreign",
  "contrast": "psalms",
  "block_size": 80,
  "boundaries": [
    357,
    437
  ],
  "n_verses": 600,
  "provenance": {
    "host_source": "genesis",
    "host_start": 10,
    "host_length_before_insertion": 520,
    "insert_source": "psalms",
    "insert_source_start": 453
  }
}
