{
  "id": "0304",
  "split": "train",
  "label": 1,
  "case_type": "foreign",
  "contrast": "mishnah",
  "block_size": 20,
  "boundaries": [
    105,
    125
  ],
  "n_verses": 600,
  "provenance": {
    "host_source": "genesis",
    "host_start": 27,
    "host_length_before_insertion": 580,
    "insert_source": "mishnah",
    "insert_source_start": 374
  }
}
