{
  "id": "0340",
  "split": "test",
  "label": 1,
  "case_type": "foreign",
  "contrast": "exodus",
  "block_size": 80,
  "boundaries": [
    347,
    427
  ],
  "n_verses": 600,
  "provenance": {
    "host_source": "genesis",
    "host_start": 784,
    "host_length_before_insertion": 520,
    "insert_source": "exodus",
    "insert_source_start": 940
  }
}
